,question,answer,contexts,ground_truth,context_precision,context_recall,faithfulness,answer_relevancy
0,What % of custom duty is imposed on cars below 800cc?,50%,"['6 \n ii. S.R.O.499(I)/2013 Dated: 12.06.2013 (Exemptions  from customs duty, \nsales tax and Income tax on import of Hybrid Electric Vehicles  \n(HEVs ) \n \n  The Federal Government allowed to exempt customs duty, sales tax and \nwithholding tax on import of Hybrid Electric Vehicles (HEVs) falling under PCT Code \n87.03, specified in column (2) of the Table below, to the extent as specified in column (3) \nthereof, namely:  \nSr. No  Engine Cap acity  Concession of d uty and taxes in US$ or \nequivalent amount in Pak rupees.  \n(1) (2) (3) \n1 Up to  1800 cc  50% \n2 From 1801 cc to 2500 cc  25% \n \niii. S.R.O.277(I)/2010 Dated: 27.04.2010 (Exemption  from custom duty \non import of new motor cars upto 1350cc for disabled persons)  \n \n   A disable person is allowed exemption of customs duty on import of new \nmotor car of engine capacity not exceeding 135 0cc, fitted with special gadgets for the \npurpose of compensating disability, for his own use subject to the following conditions  and'
 'amount specified in column (3) thereo f, \n \nSr. No  Automotive vehicles of Asian makes \nmeant for transport of persons.  Duty and taxes in US$ or equivalent \namount in Pak rupees.  \n(1) (2) (3) \n1 Up to  800c c US$ 4800  \n2 Upto 801-1000cc  US$ 6000  \n3 From 1001 -1300cc  US$ 13200  \n4 From 1301 -1500cc  US$ 18590  \n5 From 1501 -1600cc  US$ 22550  \n6 From 1601 -1800 cc \n(excluding jeeps)  US$ 27940  \n \n \nIt is relevant to mention that the Federal Government has fixed the leviable duty and taxes of \nautomotive vehicles of Asian makes meant for transport of persons as discussed above  \nirrespective of their physical condition . The Customs officers do not have any discretionary \npower to incre ase / decrease the leviable duties  / taxes .'
 '8 \n (vi)       Landing  charges @ 1% of the sum total of CIF value shall be added to \nthe price in order to arrive at the assessable value.  \n \n(vii)       The value of optional/additional accessories shall also be included in \nthe assessable value of the vehicle, which shall be subjected to the rate \nof duty and taxes applicable to the vehicle i n which the accessories are \nfitted.  \n \n(viii)      Customs duties and taxes shall be worked out on the basis of \nprescribed rates at the time of filing of the goods declaration (GD) \nexcept for old and used vehicles for which a cumulative amount of \nall leviable  duties and taxes has been notified in the Gazette.  \n \n(ix) Customs value of old and used vehicle Asian makes meant for \ntransport of persons upto 1800cc are prescribed to be determined under \nSRO 577(I)/2005 dated 6th June, 2005.  \n \n(x) Whenever, the customs value cannot be determined under SRO  \n577(I)/2005 dated 6th June, 2005, the same is to be finalized in'
 ""(i)         The FOB value of a motor vehicle at the time of its manufacture, as \ncertified by the manufacturers or their authorized local agents shall be \naccepted.  \n \n(ii)        In case of domestic models, for which the FOB values are not \nprovided by the manufacturers, the FOB values certified by the \nmanufacturers or their authorized agents in case of export models of \nsimilar vehicles shall be loaded by 5% on the C&F value.  \n \n(iii)  The local agent's commission and other incidental charges, if any, shall \nbe added to the so ascertained FOB value, if not already included in the \nprice certified by the manufacturers or their authorized local agents.  \n \n(iv)        The actual amount of ocean/ air fr eight as calculated from the country \nof original manufacture shall be added for the purpose of arriving at \nthe C&F value of the imported vehicle.  \n \n(v)        Actual amount of insurance in the country of manufacture or first""]",The customer duty on automotive vehicles of Asian makes meant for transport of persons of up to 800cc is US$ 4800,0.49999999995,1.0,1.0,0.858785760163149
1,What benefits can disabled people get on importing cars?,"Disabled people can import a new car with an engine capacity not exceeding 1,350 cc for personal use without paying customs duties once every five years, provided they meet certain eligibility criteria and conditions outlined in government notifications. These conditions include having a physical disability (excluding mental disabilities), being able to drive the car with the help of special gadgets, holding a valid driving license, and having a monthly income between Rs. 20,000 and Rs. 100,000. The car must be brand new, bear a special registration number, and display special color plates indicating it is for disabled persons. The car cannot be sold, transferred, or otherwise disposed of within five years of import, except in specific circumstances as outlined in the notification.","['No6. (1)/2009-Import-II.  Government of Pakistan  Ministry of Commerce   Islamabad, the 1"" September, 2010.    NOTIFICATION  SUBJECT: - IMPORT OF DUTY FREE CAR FOR DISABLED PERSONS.  1. Eligibility A Pakistani national sufering from physical disability (excluding mentaly retarded /handicapped and odl age disability) may apply under the Disabled Persons Scheme for import, once in ﬁve years, a new car not exceeding an engine capacity of 1,350 c for personal use without payment of custom duties provided the applicant, hereinafter referred as the ""disabled person"":-  i. is deemed to be otherwise ﬁt to drive a car i.e. he/she is not disabled due to mental retardation/ illness (mental or physical)/old age etc. and that the disability is such that can be overcome, for driving purposes, by ﬁtting special gadgets to the car. ii. possesses a valid driving license iii. has a monthly veriﬁable personal income between Rs. 20,000 and Rs. 100,000. iv. has not imported a duty free car and/or has not'
 'The Authorization shall be valid for a period of one year for import from date of issuance. Any alteration, amendment, over-writing etc. unless done by the Ministry of Commerce shall invalidate the Authorization. x. The authorized disabled person shall furnish copies of import documents and registration documents, within three months of imports.  3. Terms and Conditions i. Car imported against the Authorization shall be for personal use of the disabled person and shall not be used for commercial purposes. ii. Only brand new car shall be imported under the said scheme.  iii. The car so imported shall bear a special registration number and special color plates mentioning ""Disabled Persons Car"" so provided by the provincial excise & taxation department. iv. The car shall be driven by the person in whose favor the import authorization is issued unless otherwise speciﬁcally allowed by the Committee. v. Sale, transfer or alienation ni any other manner of the car so imported si not allowed'
 'motor car of engine capacity not exceeding 135 0cc, fitted with special gadgets for the \npurpose of compensating disability, for his own use subject to the following conditions  and \nprocedures  namely: - \n(i)  Only those disabled persons shall be entitled to import the customized cars \nwho have been issued an import authorization certificate by the Ministry of \nCommerce  as per criteria and conditions laid down in the Notificatio n No. \n6(I)/200 9-Import -III, dated 01 .09.20 10, issued by the Ministry of Commerce  \n(https://www.commerce.gov.pk/wp -content/uploads/pdf/SRO_61_2009_new.pdf );  \n \n(iii)  Only one car shall be allowed to be imported by a disabled person  in terms of \nthis notification . \n \n(iv) The car shall not be sold or otherwise transferred to any person before the \nexpiry of five years from the date of its arrival in Pakistan, except  under \ncertain conditions mentioned in the aforesaid notification.'
 'in whose favor the import authorization is issued unless otherwise speciﬁcally allowed by the Committee. v. Sale, transfer or alienation ni any other manner of the car so imported si not allowed within ﬁve years of import except a. To another disabled person on production of a valid import authorization issued by the Ministry of Commerce on recommendation of the Committee. b. On payment of custom duty and taxes as were otherwise applicable at the time of import and were exempted. c. In case of death of the authorized disabled person, the legal heirs can dispose of the vehicle, within 5 years of import, only ni the manner speciﬁed above.']","(i) PTA shall provide online application service whereby web-based user interface https://dirbs.pta.gov.pk/drs/auth/login utility can be accessed by international travelers for hassle free registration and payment of duty/taxes against mobile devices imported in accompanied baggage. This utility may also be accessed through Franchise of the Cellular Mobile Operators; [For registration the international traveler can also access DIRBS by dialing Unstructured Supplementary Service Data (USSD) Code *8484# from any mobile phone having a local SIM.](ii) The aforesaid utility will guide the applicant about the information required to be submitted for online registration of mobile devices. The system in particular will require the applicant/traveler to submit the details of passport number, Computerized national Identity Card (CNIC) number, International Motile Equipment Identity (IMEI) number etc.;(iii) 1[The above-mentioned information submitted by applicant will be auto processed/validated through WeBOC. The mobile devices will accordingly be cleared by the system in accordance with applicable rates of duty and taxes.(iv) The system shall electronically generate Payment Slip ID (PSID) for payment of duty/taxes. The applicant will then have options to pay the leviable duty/taxes through online banking, ATM, mobile banking, and bank branches of all leading.",0.0,0.0,1.0,0.9258961288768711
2,What benefits can disabled people get on importing cars in Pakistan,"
Under the Disabled Persons Scheme in Pakistan, disabled individuals who meet certain eligibility criteria can import a new car without paying customs duties once every five years. To qualify, the individual must have a physical disability (excluding mental disabilities or old age disabilities), possess a valid driving license, have a monthly income between PKR 20,000 and PKR 100,000, and be deemed fit to drive a car after installing necessary gadgets. The car must be brand new, and it cannot be used for commercial purposes. The car must also display a special registration number and color plates indicating that it belongs to a disabled person. The authorization for importing the car is valid for one year, and alterations or transfers without approval are not permitted. The sale, transfer, or alienation of the car is also prohibited during the initial five years of ownership. This benefit is separate from the federal government's concessions and exemptions on importing specific types of old and used automotive vehicles.","['No6. (1)/2009-Import-II.  Government of Pakistan  Ministry of Commerce   Islamabad, the 1"" September, 2010.    NOTIFICATION  SUBJECT: - IMPORT OF DUTY FREE CAR FOR DISABLED PERSONS.  1. Eligibility A Pakistani national sufering from physical disability (excluding mentaly retarded /handicapped and odl age disability) may apply under the Disabled Persons Scheme for import, once in ﬁve years, a new car not exceeding an engine capacity of 1,350 c for personal use without payment of custom duties provided the applicant, hereinafter referred as the ""disabled person"":-  i. is deemed to be otherwise ﬁt to drive a car i.e. he/she is not disabled due to mental retardation/ illness (mental or physical)/old age etc. and that the disability is such that can be overcome, for driving purposes, by ﬁtting special gadgets to the car. ii. possesses a valid driving license iii. has a monthly veriﬁable personal income between Rs. 20,000 and Rs. 100,000. iv. has not imported a duty free car and/or has not'
 'motor car of engine capacity not exceeding 135 0cc, fitted with special gadgets for the \npurpose of compensating disability, for his own use subject to the following conditions  and \nprocedures  namely: - \n(i)  Only those disabled persons shall be entitled to import the customized cars \nwho have been issued an import authorization certificate by the Ministry of \nCommerce  as per criteria and conditions laid down in the Notificatio n No. \n6(I)/200 9-Import -III, dated 01 .09.20 10, issued by the Ministry of Commerce  \n(https://www.commerce.gov.pk/wp -content/uploads/pdf/SRO_61_2009_new.pdf );  \n \n(iii)  Only one car shall be allowed to be imported by a disabled person  in terms of \nthis notification . \n \n(iv) The car shall not be sold or otherwise transferred to any person before the \nexpiry of five years from the date of its arrival in Pakistan, except  under \ncertain conditions mentioned in the aforesaid notification.'
 '5 \n Benefits/ Exemption s  Allowed By Federal Government on Import of \nVehicles  \n  The Federal Government of Pakistan has extended various benefits / \nexemptions to the taxpayers for importing vehicles. The details concessions / exemptions are \ngiven as under: - \ni. S.R.O. 577(I)/2005 Dated 06.06.2005 (Exemption from customs duty, \nsales tax, withholding tax on  import of  certain s pecified Old and \nused automotive vehicles )  \n \n  The import  of old and used automotive vehicles of Asian makes meant for \ntransport of persons, specified in column (2) of the Table below, falling under PCT heading \nNo. 87.03 of the First Schedule to the Customs Act, 1969 (IV of 1969), is exempted from so \nmuch of the customs -duty, sales tax and withholding tax as are in excess of the cumulative \namount specified in column (3) thereo f, \n \nSr. No  Automotive vehicles of Asian makes \nmeant for transport of persons.  Duty and taxes in US$ or equivalent \namount in Pak rupees.  \n(1) (2) (3)'
 'The Authorization shall be valid for a period of one year for import from date of issuance. Any alteration, amendment, over-writing etc. unless done by the Ministry of Commerce shall invalidate the Authorization. x. The authorized disabled person shall furnish copies of import documents and registration documents, within three months of imports.  3. Terms and Conditions i. Car imported against the Authorization shall be for personal use of the disabled person and shall not be used for commercial purposes. ii. Only brand new car shall be imported under the said scheme.  iii. The car so imported shall bear a special registration number and special color plates mentioning ""Disabled Persons Car"" so provided by the provincial excise & taxation department. iv. The car shall be driven by the person in whose favor the import authorization is issued unless otherwise speciﬁcally allowed by the Committee. v. Sale, transfer or alienation ni any other manner of the car so imported si not allowed']","A disable person is allowed exemption of customs duty on import of new motor car of engine capacity not exceeding 1350cc, fitted with special gadgets for the purpose of compensating disability, for his own use subject to the following conditions and procedures namely:-(i) Only those disabled persons shall be entitled to import the customized cars who have been issued an import authorization certificate by the Ministry of Commerce as per criteria and conditions laid down in the Notification No. 6(I)/2009-Import-III, dated 01.09.2010, issued by the Ministry of Commerce (https://www.commerce.gov.pk/wp-content/uploads/pdf/SRO_61_2009_new.pdf);(iii) Only one car shall be allowed to be imported by a disabled person in terms of this notification.(iv) The car shall not be sold or otherwise transferred to any person before the expiry of five years from the date of its arrival in Pakistan, except under certain conditions mentioned in the aforesaid notification.",0.999999999975,1.0,1.0,0.9246560192349712
3,What is the procedure of temporary registration of phones for foreign nationals?,"The procedure for temporary registration of phones for foreign nationals involves providing credentials such as passport number, date of arrival, intended date of departure, and mobile SIM issued in their name, as well as the IMEI(s) of the device, through the web-based registration facility available at the link https://dirbs.pta.gov.pk/drs. The system will validate and verify the entered mobile number from mobile operators and cross-check the date of arrival from the FIA Integrated Border Management System (IBMS). If the checks are successful, the system will electronically generate a PSID for payment of duty/taxes and prescribed fine, which can be paid through various methods. Once payment is confirmed, the mobile device will be whitelisted in DIRBS. Travelers can also register their mobile devices brought-in accompanied baggage within 60 days of arrival. For overseas Pakistanis/foreigners visiting Pakistan on short-term visits, this temporary registration facilitation module will apply to only one mobile device, and they must provide their credentials and IMEI(s) through the web-based registration facility. For locally traded un-registered mobile devices, the holder/proprietor must declare them at the nearest Collectorate of Customs, provide soft copy of IMEI details in excel format, and obtain a CoC from the PTA after processing the application. The Customs authorities will then release the device upon issuance of the CoC.","['web-based registration available at link https://dirbs.pta.gov.pk/drs (i)  This temporary /registration facilitation module for overseas Pakistanis/ Foreigners will be applicable for only one (1) mobile handset device.  (ii)  To avail this facility, the applicant shall provide his/her credentials   including passport No., date of arrival and intended date of departure,   mobile SIM issued in his/her name, IMEI(s) of the device.  (iii)  The system shall carry out validation/verification on real time basis for   the entered mobile number from mobile operators to validate/verify that   the said SIM has been issued in the name of the applicant only. In case   of non-validation/non-verification, the application will not be processed   any further.  (iv)  The system shall carry out real time validation from FIA Integrated Border Management System (IBMS) to verify the date of arrival of applicant. In case of non-validation/non-verification, the application shall not be processed any'
 'Furthermore, all above stated checks will be re-verified from FIA and Mobile operators for the said temporary registration.]  B.  REGISTRATION OF MOBILE DEVICES BY LOCAL APPLICANT (i)  The local resident may also register the mobile device using above mentioned web-based utility. The applicant will be guided by the system to provide the details of CNIC number, IMEI number of the mobile device seeking registration in DIRBS. (ii)  On submission of aforesaid information, the system shall electronically generate PSID for payment of duty/taxes and prescribed fine. The applicant will have options to pay the leviable duty/taxes and fine through online banking, ATM, mobile banking and bank branches of all leading banks. (iii)  Once the system confirms the payment of duty/taxes along with fine amount, the mobile device will be whitelisted in DIRBS. 2[C.  REGISTRATION OF MOBILE DEVICES IMPORTED BY INDIVIDUALS   THROUGH POSTAL SERVICE OR COURIER  (i)  All mobile devices imported by the'
 'banks. Once the system confirms the payment of duty/taxes, the mobile device will be whitelisted in DIRBS. (v) The travelers can register the mobile devices brought-in accompanied baggage   following above procedure within sixty (60) days of their arrival in Pakistan. (vi) After the expiry of aforesaid time-limit such mobile devices shall be registered   on payment of leviable duty/taxes along with prescribed fine notified for the   purpose;] 21AA.TEMPORARY REGISTRATION OF MOBILE DEVICE FOR OVERSEAS   PAKISTANIS, FOREIGN NATIONALS THROUGH DIRBS  The following mechanism shall be followed for temporary registration of mobile  devices in use of overseas Pakistanis/ Foreigners (including those working abroad or  Pakistani students studying aboard) visiting Pakistan on short term visits through  web-based registration available at link https://dirbs.pta.gov.pk/drs (i)  This temporary /registration facilitation module for overseas Pakistanis/ Foreigners will be applicable for only one'
 'be confiscated and disposed of in accordance with the law.""  D. REGISTRATION   OF   MOBILE   DEVICES   IMPORTED   ILLEGALLY   THROUGH INFORMAL CHANNELS BY LOCAL TRADERS  (i)  The holder/proprietor of un-registered mobile devices shall voluntarily approach the nearest Collectorate of Customs and file declaration as provided at Annex-B along with soft copy of IMEI details of such devices in excel format. (ii)  On receipt of declaration, the designated Customs official shall verify the particulars and endorse the stamp on the declaration form and detain the mobile device. (iii)  Thereafter, the holder shall file an application supported with duly stamped declaration form before PTA for issuance of CoC along with soft form excel sheet containing IMEI of device(s).  The PTA shall process the application in accordance with their SoP and accordingly issue CoC. (iv)  Upon issuance of CoC, the applicant shall approach the Customs authorities for release of the mobile device. The Customs']","The following mechanism shall be followed for temporary registration of mobile devices in use of overseas Pakistanis/ Foreigners (including those working abroad or Pakistani students studying aboard) visiting Pakistan on short term visits through web-based registration available at link https://dirbs.pta.gov.pk/drs(i) This temporary /registration facilitation module for overseas Pakistanis/ Foreigners will be applicable for only one (1) mobile handset device.(ii) To avail this facility, the applicant shall provide his/her credentials including passport No., date of arrival and intended date of departure, mobile SIM issued in his/her name, IMEI(s) of the device.(iii) The system shall carry out validation/verification on real time basis for the entered mobile number from mobile operators to validate/verify that the said SIM has been issued in the name of the applicant only. In case of non-validation/non-verification, the application will not be processed any further.(iv) The system shall carry out real time validation from FIA Integrated Border Management System (IBMS) to verify the date of arrival of applicant. In case of non-validation/non-verification, the application shall not be processed any further.(v) Upon these validations/verifications from FIA and Mobile Operators, the application shall be processed, and the applied IMEI(s) will be paired with the applied mobile number. This will allow mobile service with the declared SIM/mobile number only and in case of insertion of any other SIM, the device shall not allow any network connectivity.(vi) An IMEI which has been applied once for this facility if applied again by using another person's passport, the same IMEI shall not be allowed this facility and will require the device to be registered as per prevailing procedures of payment of applicable duty and taxes.(vii) On lapse of 120 days, the IMEI(s) utilized under this facility shall be blacklisted and shall not be allowed local network services.(viii) In case, the same applicant visits Pakistan again, he/she will be required to re-apply for this temporary facility with the same credentials which were used for the 1St or previous registration under this scheme. Furthermore, all above stated checks will be re-verified from FIA and Mobile operators for the said temporary registration.",0.999999999975,1.0,1.0,0.998178771813361
4,What is the custom duty on products imported from China?,"The customs duty on products imported from China depends on various factors such as the type of product, its classification under the PCT system, and the specific duties and taxes applicable at the time and place of importation. The exact rate of duty can be determined by consulting the relevant customs schedules and rules, as outlined in documents such as THE CUSTOMS ACT 1969 and the Fifth Schedule-23-24. Some products may be eligible for exemptions or concessions, while others may be subject to standard rates of duty. It is recommended to consult a customs expert or regulatory authority for specific guidance on customs duty calculations for imports from China.","['on payment of customs -duty equal to the aggregate amount of all such \nduties and taxes calculated at the rates prevailing at the time and place of \nimportation of goods; or  \n(c) in any other cas e, without payment of duty.  \n \n29a[22A.  Temporary export of imported plant and machinery. - Imported plant \nand machinery, temporarily exported that have not undergone any alteration, \nrenovation, addition or refurbishment, may be re -imported duty free subject  to the \nspecific or general terms and conditions the Board may by the rules prescribe.]  \n \n23.  Goods, derelict, wreck, etc. -  All goods, derelict, jetsam, flotsam  and \nwreck, brought or coming into Pakistan, shall be dealt with as if they were imported \ninto Pakistan.'
 'in respect of goods which  have been taken into use between their importation and \nsubsequent exportation shall be made in accordance with the provisions of the rules \nmade in that behalf.  \n \n37. Drawback on goods used in the manufacture of goods which are exported. -  \nWhere it appears to the Board that in respect of goods of any class or description \nmanufactured in Pakistan and exported to any place outside Pakistan, a drawback of \ncustoms -duties should be allowed on any imported goods of a class or description used \nin the manufacture of su ch exported goods, the Board may, by notification in the \nofficial Gazette, direct that drawback shall be allowed in respect of such imported \ngoods to such extent and subject to such condition as may be provided in the rules.'
 'THE CUSTOMS ACT,1969  \n \n29 \n  (b) there shall also be added to such price, to the extent that they are \nincurred by the importer but are not included in the price actually \npaid or payable of the imported goods - \n \n (i) commissions including indenting commissions and  \n brokerage, except buying commissions;  \n(ii) the cost of containers which are treated as being one  \nfor customs purposes with the goods in question; and  \n(iii) the cost of packing whether for labour or materials;       \n \n(c)  there shall also be added to such price the value, apportio ned as \nappropriate, of the following goods and services where supplied \ndirectly or indirectly by the importer or his related person free of \ncharge or at reduced cost, for use in connection with the \nproduction and sale for export of the imported goods, to t he \nextent that such value has not been included in the price actually \npaid or payable:   \n \n(i) materials, components, parts and similar items'
 '797 \n FBR; and  \n(d) these items, if \nrendered as scrap, \nwith change in their \nphysical status, \ncomposition or \ncondition and PCT \nclassification, shall \nbe chargeable to \nduties & taxes \naccordingly, at \nstandard rates;  \n \n4.  In the event a dispute \narises wheth er any item \nis entitled to exemption \nunder this schedule, the \nitem will be immediately \nreleased by the Customs \nDepartment against a \ncorporate guarantee valid \nfor a period of nine \nmonths, extendable by \nthe concerned Collector \nof Customs on time to \ntime basi s. A certificate \nfrom the relevant \nRegulatory Authority that \nthe item is covered under \nthis serial number shall \nbe given due \nconsideration by the \nCustoms Department \ntowards finally resolving \nthe dispute. Disputes \nregarding the local \nmanufacturing only shal l \nbe resolved through the \nEngineering \nDevelopment Board.  \n4. Machinery, equipment, vessels, dumpers, specialized \nvehicles, accessories, spares and all other items essentially']","For the purpose of implementing Rule 8(b) of the China-Pakistan FTA Rules of Origin, where transportation is affected through the territory outside the two member states, the following shall be produced to the Government authorities of the importing Member State:(a) A through Bill of Lading issued in the exporting Member State.(b) A Certificate of Origin issued by the relevant Government authorities of the exporting Member State.(d) A copy of the original commercial invoice in respect of the product: and(e) Supporting documents in evidence that the requirements of Rule 8(b) sub-paragraphs (i), (ii) and (iii) of the China-Pakistan FTA Rules ofOrigin are being complied with.",0.0,0.0,1.0,0.9545912633225077
